experiment_id,tracker,tracker_config,detector,source,condition_profile,processed_frames,active_track_count,new_track_count,lost_track_count,recovered_track_count,mean_pipeline_latency_ms,p95_pipeline_latency_ms,pipeline_fps,avg_track_age_frames,id_switch_count,fragmentation_count,class_switch_raw_count,class_switch_suppressed_count,speed_trail_usable,plate_temporal_voting_usable,evidence_track_usable,license_status,decision,notes
TRK-EXP-001,ByteTrack,bytetrack.yaml,yolo11n.pt,Test/video_1-3_manual,dark,1263,15,15,TBD_manual,TBD_manual,17.665,25.284,31.742,111.014,TBD_manual,TBD_manual,15,29,TBD_manual,TBD_manual,TBD_manual,MIT_tracker_ultralytics_license_review,completed_first_baseline,Automated tracking run completed; ID switches and usability require manual review; latency is detector+tracker pipeline call
TRK-EXP-002,BoT-SORT,botsort.yaml_reid_off,yolo11n.pt,Test/video_1-3_manual,dark,1263,15,15,TBD_manual,TBD_manual,28.47,34.986,23.771,111.042,TBD_manual,TBD_manual,14,38,TBD_manual,TBD_manual,TBD_manual,MIT_tracker_ultralytics_license_review,completed_second_baseline,Automated tracking run completed; ID switches and usability require manual review; latency is detector+tracker pipeline call
TRK-EXP-003,BoT-SORT,botsort.yaml_reid_on,selected_pretrained_detector,Test/video_1-3_manual,dark,TBD,TBD,TBD,TBD,TBD,TBD,TBD,TBD,TBD,TBD,TBD,TBD,TBD,TBD,TBD,TBD,MIT_tracker_ultralytics_license_review,optional,Run only if ID switch/occlusion problems justify ReID latency
TRK-EXP-004,OC-SORT,ocsort_default,selected_pretrained_detector,Test/video_1-3_manual,dark,TBD,TBD,TBD,TBD,TBD,TBD,TBD,TBD,TBD,TBD,TBD,TBD,TBD,TBD,TBD,TBD,MIT_review_required,optional_third_candidate,Run if ByteTrack and BoT-SORT are insufficient
TRK-EXP-005,Kalman-IoU,custom_simple,selected_pretrained_detector,Test/video_1-3_manual,dark,TBD,TBD,TBD,TBD,TBD,TBD,TBD,TBD,TBD,TBD,TBD,TBD,TBD,TBD,TBD,TBD,internal,optional_debug_fallback,Simple interpretable fallback/debug tracker
